{"normalizationNotes":["Synthetic fixture generated from the official expected set; it is not an external model run."],"protocol":"urn:aduc:model-conformance-result:0.1","rawOutput":{"mediaType":"text/plain","path":"raw/illustrative-b.txt","sha256":"sha256:579a6737737ec3391e965539cfde2270728375f2fe2c236a6af09a14c83c15dd"},"results":[{"classification":"comparable","dimensions":{"entity":"notEvaluated","time":"notEvaluated","unit":"notEvaluated"},"evidence":["urn:aduc:conformance:assertion:exact-a","urn:aduc:conformance:assertion:exact-b"],"profileA":{"assertionId":"urn:aduc:conformance:assertion:exact-a","localReference":"/properties/temp_moteur","mappingRelation":"http://www.w3.org/2004/02/skos/core#exactMatch","semanticTarget":"urn:aduc:concept:MotorTemperature","status":"reviewed"},"profileB":{"assertionId":"urn:aduc:conformance:assertion:exact-b","localReference":"/properties/motor_temp","mappingRelation":"http://www.w3.org/2004/02/skos/core#exactMatch","semanticTarget":"urn:aduc:concept:MotorTemperature","status":"canonical"},"reasons":["identical semantic target with non-inferred exact mappings"],"scenarioId":"exact-different-names"},{"classification":"candidate","dimensions":{"entity":"notEvaluated","time":"notEvaluated","unit":"notEvaluated"},"evidence":["urn:aduc:conformance:assertion:inferred-a","urn:aduc:conformance:assertion:inferred-b"],"profileA":{"assertionId":"urn:aduc:conformance:assertion:inferred-a","localReference":"/properties/q","mappingRelation":"http://www.w3.org/2004/02/skos/core#exactMatch","semanticTarget":"urn:aduc:concept:WaterDischarge","status":"inferred"},"profileB":{"assertionId":"urn:aduc:conformance:assertion:inferred-b","localReference":"/properties/flow","mappingRelation":"http://www.w3.org/2004/02/skos/core#exactMatch","semanticTarget":"urn:aduc:concept:WaterDischarge","status":"reviewed"},"reasons":["at least one mapping assertion is inferred"],"scenarioId":"inferred-candidate"},{"classification":"candidate","dimensions":{"entity":"notEvaluated","time":"notEvaluated","unit":"notEvaluated"},"evidence":["urn:aduc:conformance:assertion:close-a","urn:aduc:conformance:assertion:close-b"],"profileA":{"assertionId":"urn:aduc:conformance:assertion:close-a","localReference":"/properties/heat","mappingRelation":"http://www.w3.org/2004/02/skos/core#closeMatch","semanticTarget":"urn:aduc:concept:Temperature","status":"reviewed"},"profileB":{"assertionId":"urn:aduc:conformance:assertion:close-b","localReference":"/properties/temperature","mappingRelation":"http://www.w3.org/2004/02/skos/core#exactMatch","semanticTarget":"urn:aduc:concept:Temperature","status":"reviewed"},"reasons":["at least one mapping relation is not skos:exactMatch"],"scenarioId":"close-match-candidate"},{"classification":"blocked","dimensions":{"entity":"notEvaluated","time":"notEvaluated","unit":"notEvaluated"},"evidence":["urn:aduc:conformance:assertion:contested-a","urn:aduc:conformance:assertion:contested-b"],"profileA":{"assertionId":"urn:aduc:conformance:assertion:contested-a","localReference":"/properties/risk","mappingRelation":"http://www.w3.org/2004/02/skos/core#exactMatch","semanticTarget":"urn:aduc:concept:FailureRisk","status":"contested"},"profileB":{"assertionId":"urn:aduc:conformance:assertion:contested-b","localReference":"/properties/failure_risk","mappingRelation":"http://www.w3.org/2004/02/skos/core#exactMatch","semanticTarget":"urn:aduc:concept:FailureRisk","status":"reviewed"},"reasons":["at least one mapping assertion is contested"],"scenarioId":"contested-blocked"},{"classification":"unmapped","dimensions":{"entity":"notEvaluated","time":"notEvaluated","unit":"notEvaluated"},"evidence":["urn:aduc:conformance:assertion:name-a","urn:aduc:conformance:assertion:name-b"],"profileA":{"assertionId":"urn:aduc:conformance:assertion:name-a","localReference":"/properties/temperature","mappingRelation":"http://www.w3.org/2004/02/skos/core#exactMatch","semanticTarget":"urn:aduc:concept:AirTemperature","status":"reviewed"},"profileB":{"assertionId":"urn:aduc:conformance:assertion:name-b","localReference":"/properties/temperature","mappingRelation":"http://www.w3.org/2004/02/skos/core#exactMatch","semanticTarget":"urn:aduc:concept:ColorTemperature","status":"reviewed"},"reasons":["semantic targets differ; local-name similarity is not evidence"],"scenarioId":"same-name-different-targets"},{"classification":"comparable","dimensions":{"entity":"notEvaluated","time":"notEvaluated","unit":"notEvaluated"},"evidence":["urn:aduc:conformance:assertion:dimensions-a","urn:aduc:conformance:assertion:dimensions-b"],"profileA":{"assertionId":"urn:aduc:conformance:assertion:dimensions-a","localReference":"/properties/value_a","mappingRelation":"http://www.w3.org/2004/02/skos/core#exactMatch","semanticTarget":"urn:aduc:concept:Pressure","status":"reviewed"},"profileB":{"assertionId":"urn:aduc:conformance:assertion:dimensions-b","localReference":"/properties/value_b","mappingRelation":"http://www.w3.org/2004/02/skos/core#exactMatch","semanticTarget":"urn:aduc:concept:Pressure","status":"reviewed"},"reasons":["identical semantic target with non-inferred exact mappings"],"scenarioId":"missing-dimensions"}],"run":{"executedAt":"2026-07-13T18:00:00Z","externalContextUsed":false,"implementation":"reference-fixture-b","kind":"illustrative","model":"fixture-model-b","modelVersion":"fixture-1","packageDigest":"sha256:688e505409a10ffc73c8c7792cabe3822e6b7c26c0bf6f60a56c1af3d810d3f8","parameters":{"temperature":0},"provider":"illustrative-provider-b","repeat":1,"runId":"urn:aduc:conformance:run:illustrative-b"}}
